web-scraper-order,web-scraper-start-url,author,title,date,content,rating,next,next-href
"1574322807-10461","https://www.amazon.com/Hasbro-Gaming-C1293-Clue-Junior/product-reviews/B01ISKSH2Q/ref=cm_cr_dp_d_show_all_btm?ie=UTF8&reviewerType=all_reviews","Jennifer H.","Favorite Family Game Night Game","June 10, 2019","My 5 year old LOVES Clue Jr.  This game is great and is our go to game on family game nights.  It helps with learning strategy and they love using their detective skills.  The junior version is more age appropriate than the murder mystery that I remember playing.  The kids love discovering ""who ate the cake"", ""at what time"" and with ""what to drink"".  The whole family will love it.","5.0 out of 5 stars","Next page→","https://www.amazon.com/Hasbro-Gaming-C1293-Clue-Junior/product-reviews/B01ISKSH2Q/ref=cm_cr_arp_d_paging_btm_4?ie=UTF8&pageNumber=4&reviewerType=all_reviews"
"1574322861-10702","https://www.amazon.com/Hasbro-Gaming-C1293-Clue-Junior/product-reviews/B01ISKSH2Q/ref=cm_cr_dp_d_show_all_btm?ie=UTF8&reviewerType=all_reviews","cory","Three Stars","March 27, 2017","Good game for older children. My son is 6 can't understand or follow it.","3.0 out of 5 stars","Next page→","https://www.amazon.com/Hasbro-Gaming-C1293-Clue-Junior/product-reviews/B01ISKSH2Q/ref=cm_cr_arp_d_paging_btm_28?ie=UTF8&pageNumber=28&reviewerType=all_reviews"
"1574322809-10476","https://www.amazon.com/Hasbro-Gaming-C1293-Clue-Junior/product-reviews/B01ISKSH2Q/ref=cm_cr_dp_d_show_all_btm?ie=UTF8&reviewerType=all_reviews","Sammy","Great for kids, still fun for adults too!","August 16, 2019","This is such an adorable version of this game. This is my son's favorite board game to play. Instead of cards there are peices that attach to the bottom of the characters and furniture. It is a very well made game.","5.0 out of 5 stars","Next page→","https://www.amazon.com/Hasbro-Gaming-C1293-Clue-Junior/product-reviews/B01ISKSH2Q/ref=cm_cr_arp_d_paging_btm_5?ie=UTF8&pageNumber=5&reviewerType=all_reviews"
"1574322829-10562","https://www.amazon.com/Hasbro-Gaming-C1293-Clue-Junior/product-reviews/B01ISKSH2Q/ref=cm_cr_dp_d_show_all_btm?ie=UTF8&reviewerType=all_reviews","E W","Great addition to elementary school aged collection.","July 28, 2018","Great for our elementary game collection. A little long at times, but great introduction to puzzle solving/logic games.","5.0 out of 5 stars","Next page→","https://www.amazon.com/Hasbro-Gaming-C1293-Clue-Junior/product-reviews/B01ISKSH2Q/ref=cm_cr_arp_d_paging_btm_14?ie=UTF8&pageNumber=14&reviewerType=all_reviews"
"1574322849-10656","https://www.amazon.com/Hasbro-Gaming-C1293-Clue-Junior/product-reviews/B01ISKSH2Q/ref=cm_cr_dp_d_show_all_btm?ie=UTF8&reviewerType=all_reviews","Lynette Hamby","Price was good and fast shipping","January 2, 2019","Kids love it","5.0 out of 5 stars","Next page→","https://www.amazon.com/Hasbro-Gaming-C1293-Clue-Junior/product-reviews/B01ISKSH2Q/ref=cm_cr_arp_d_paging_btm_23?ie=UTF8&pageNumber=23&reviewerType=all_reviews"
"1574322840-10618","https://www.amazon.com/Hasbro-Gaming-C1293-Clue-Junior/product-reviews/B01ISKSH2Q/ref=cm_cr_dp_d_show_all_btm?ie=UTF8&reviewerType=all_reviews","Tiffany L Sullivan","Pretty good","July 18, 2019","I liked all the looking under things. When characters block your path it's hard. (Sons words)","4.0 out of 5 stars","Next page→","https://www.amazon.com/Hasbro-Gaming-C1293-Clue-Junior/product-reviews/B01ISKSH2Q/ref=cm_cr_arp_d_paging_btm_19?ie=UTF8&pageNumber=19&reviewerType=all_reviews"
"1574322856-10687","https://www.amazon.com/Hasbro-Gaming-C1293-Clue-Junior/product-reviews/B01ISKSH2Q/ref=cm_cr_dp_d_show_all_btm?ie=UTF8&reviewerType=all_reviews","Carol Sykes","he seems to like","December 26, 2017","gave it as a gift, he seems to like it","4.0 out of 5 stars","Next page→","https://www.amazon.com/Hasbro-Gaming-C1293-Clue-Junior/product-reviews/B01ISKSH2Q/ref=cm_cr_arp_d_paging_btm_26?ie=UTF8&pageNumber=26&reviewerType=all_reviews"
"1574322836-10597","https://www.amazon.com/Hasbro-Gaming-C1293-Clue-Junior/product-reviews/B01ISKSH2Q/ref=cm_cr_dp_d_show_all_btm?ie=UTF8&reviewerType=all_reviews","Carmyn Boucher","Missing half the game pieces so never got to play.","December 27, 2018","Sealed box was missing the dice as well as thje white bases and one of the cardboard sheets. Cant play with out that stuff.","1.0 out of 5 stars","Next page→","https://www.amazon.com/Hasbro-Gaming-C1293-Clue-Junior/product-reviews/B01ISKSH2Q/ref=cm_cr_arp_d_paging_btm_17?ie=UTF8&pageNumber=17&reviewerType=all_reviews"
"1574322842-10625","https://www.amazon.com/Hasbro-Gaming-C1293-Clue-Junior/product-reviews/B01ISKSH2Q/ref=cm_cr_dp_d_show_all_btm?ie=UTF8&reviewerType=all_reviews","Lucille C Chorba","Really Fun Game","December 28, 2018","I grew up with the original Clue Game but as that is a little advanced for 5 year olds the junior version was a great start!!! Very clever!","5.0 out of 5 stars","Next page→","https://www.amazon.com/Hasbro-Gaming-C1293-Clue-Junior/product-reviews/B01ISKSH2Q/ref=cm_cr_arp_d_paging_btm_20?ie=UTF8&pageNumber=20&reviewerType=all_reviews"
"1574322811-10485","https://www.amazon.com/Hasbro-Gaming-C1293-Clue-Junior/product-reviews/B01ISKSH2Q/ref=cm_cr_dp_d_show_all_btm?ie=UTF8&reviewerType=all_reviews","Rtrogrl","Fun!","August 1, 2019","This was a fun, simpler version of Clue for young ones to enjoy, but still fun for adults.  Our 5 year old grandson had a great time playing with us, and was excited to tell his parents all about it. :)  Great price, arrived quickly and packaged securely.","5.0 out of 5 stars","Next page→","https://www.amazon.com/Hasbro-Gaming-C1293-Clue-Junior/product-reviews/B01ISKSH2Q/ref=cm_cr_arp_d_paging_btm_6?ie=UTF8&pageNumber=6&reviewerType=all_reviews"
"1574322831-10577","https://www.amazon.com/Hasbro-Gaming-C1293-Clue-Junior/product-reviews/B01ISKSH2Q/ref=cm_cr_dp_d_show_all_btm?ie=UTF8&reviewerType=all_reviews","Stephanie yin","Good game for kids","January 27, 2019","Shipped quick, good integrity. My 5 year old niece loved it for Christmas.","5.0 out of 5 stars","Next page→","https://www.amazon.com/Hasbro-Gaming-C1293-Clue-Junior/product-reviews/B01ISKSH2Q/ref=cm_cr_arp_d_paging_btm_15?ie=UTF8&pageNumber=15&reviewerType=all_reviews"
"1574322844-10638","https://www.amazon.com/Hasbro-Gaming-C1293-Clue-Junior/product-reviews/B01ISKSH2Q/ref=cm_cr_dp_d_show_all_btm?ie=UTF8&reviewerType=all_reviews","gigi31","Evening game night!","January 1, 2018","My niece loved this fame for Christmas","5.0 out of 5 stars","Next page→","https://www.amazon.com/Hasbro-Gaming-C1293-Clue-Junior/product-reviews/B01ISKSH2Q/ref=cm_cr_arp_d_paging_btm_21?ie=UTF8&pageNumber=21&reviewerType=all_reviews"
"1574322822-10530","https://www.amazon.com/Hasbro-Gaming-C1293-Clue-Junior/product-reviews/B01ISKSH2Q/ref=cm_cr_dp_d_show_all_btm?ie=UTF8&reviewerType=all_reviews","Lorin","Great easy game.","July 10, 2019","I play it with my 10 year old and 6 year old and they both enjoy it. Even fun for me.","5.0 out of 5 stars","Next page→","https://www.amazon.com/Hasbro-Gaming-C1293-Clue-Junior/product-reviews/B01ISKSH2Q/ref=cm_cr_arp_d_paging_btm_11?ie=UTF8&pageNumber=11&reviewerType=all_reviews"
"1574322854-10670","https://www.amazon.com/Hasbro-Gaming-C1293-Clue-Junior/product-reviews/B01ISKSH2Q/ref=cm_cr_dp_d_show_all_btm?ie=UTF8&reviewerType=all_reviews","marc keltz","Five Stars","August 27, 2018","great tho share with the grandkids and makes them exercise their brain without electronics.","5.0 out of 5 stars","Next page→","https://www.amazon.com/Hasbro-Gaming-C1293-Clue-Junior/product-reviews/B01ISKSH2Q/ref=cm_cr_arp_d_paging_btm_25?ie=UTF8&pageNumber=25&reviewerType=all_reviews"
"1574322831-10576","https://www.amazon.com/Hasbro-Gaming-C1293-Clue-Junior/product-reviews/B01ISKSH2Q/ref=cm_cr_dp_d_show_all_btm?ie=UTF8&reviewerType=all_reviews","Packer Fan","Great for 7 year old boys","May 2, 2019","Better than who murdered who in the grown up version","5.0 out of 5 stars","Next page→","https://www.amazon.com/Hasbro-Gaming-C1293-Clue-Junior/product-reviews/B01ISKSH2Q/ref=cm_cr_arp_d_paging_btm_15?ie=UTF8&pageNumber=15&reviewerType=all_reviews"
"1574322820-10520","https://www.amazon.com/Hasbro-Gaming-C1293-Clue-Junior/product-reviews/B01ISKSH2Q/ref=cm_cr_dp_d_show_all_btm?ie=UTF8&reviewerType=all_reviews","Amazon Customer","Great modification!","February 2, 2019","Thankfully this game is not about murder or crimes. Players try to find who at the cake, at what time, and in which room. We’ve played over and over.","5.0 out of 5 stars","Next page→","https://www.amazon.com/Hasbro-Gaming-C1293-Clue-Junior/product-reviews/B01ISKSH2Q/ref=cm_cr_arp_d_paging_btm_10?ie=UTF8&pageNumber=10&reviewerType=all_reviews"
"1574322813-10493","https://www.amazon.com/Hasbro-Gaming-C1293-Clue-Junior/product-reviews/B01ISKSH2Q/ref=cm_cr_dp_d_show_all_btm?ie=UTF8&reviewerType=all_reviews","Eun Shin","Cheaply made with paper game pieces that rip","October 27, 2019","Cheaply made.  Paper game pieces that rip easily.  There are stickers for the board, which sounds like fun for kids, but very young kids will stick them everywhere and make the board unusable.","1.0 out of 5 stars","Next page→","https://www.amazon.com/Hasbro-Gaming-C1293-Clue-Junior/product-reviews/B01ISKSH2Q/ref=cm_cr_arp_d_paging_btm_7?ie=UTF8&pageNumber=7&reviewerType=all_reviews"
"1574322854-10674","https://www.amazon.com/Hasbro-Gaming-C1293-Clue-Junior/product-reviews/B01ISKSH2Q/ref=cm_cr_dp_d_show_all_btm?ie=UTF8&reviewerType=all_reviews","Pam T","Grandson loves it","July 28, 2018","Grandson loves it","4.0 out of 5 stars","Next page→","https://www.amazon.com/Hasbro-Gaming-C1293-Clue-Junior/product-reviews/B01ISKSH2Q/ref=cm_cr_arp_d_paging_btm_25?ie=UTF8&pageNumber=25&reviewerType=all_reviews"
"1574322807-10468","https://www.amazon.com/Hasbro-Gaming-C1293-Clue-Junior/product-reviews/B01ISKSH2Q/ref=cm_cr_dp_d_show_all_btm?ie=UTF8&reviewerType=all_reviews","LauraN","Great for six year old","March 15, 2019","My husband and my six year old have never played clue before. I'd expect that from my six year old but was surprised with my husband! We had such a fun time playing and my daughter picked it up pretty quickly. It took one round to help her learn and then she played the next few rounds rather easily. Def a great family night game with younger kids!","5.0 out of 5 stars","Next page→","https://www.amazon.com/Hasbro-Gaming-C1293-Clue-Junior/product-reviews/B01ISKSH2Q/ref=cm_cr_arp_d_paging_btm_4?ie=UTF8&pageNumber=4&reviewerType=all_reviews"
"1574322833-10589","https://www.amazon.com/Hasbro-Gaming-C1293-Clue-Junior/product-reviews/B01ISKSH2Q/ref=cm_cr_dp_d_show_all_btm?ie=UTF8&reviewerType=all_reviews","Brianne Mancini","Fun Game!","June 19, 2018","Bought this for my niece and nephew (7 and 9) and they have a great time playing it!","5.0 out of 5 stars","Next page→","https://www.amazon.com/Hasbro-Gaming-C1293-Clue-Junior/product-reviews/B01ISKSH2Q/ref=cm_cr_arp_d_paging_btm_16?ie=UTF8&pageNumber=16&reviewerType=all_reviews"
"1574322854-10678","https://www.amazon.com/Hasbro-Gaming-C1293-Clue-Junior/product-reviews/B01ISKSH2Q/ref=cm_cr_dp_d_show_all_btm?ie=UTF8&reviewerType=all_reviews","Jean Klahn","Five Stars","January 31, 2018","Perfect game for my 10 year old.  She loves it.","5.0 out of 5 stars","Next page→","https://www.amazon.com/Hasbro-Gaming-C1293-Clue-Junior/product-reviews/B01ISKSH2Q/ref=cm_cr_arp_d_paging_btm_25?ie=UTF8&pageNumber=25&reviewerType=all_reviews"
"1574322822-10538","https://www.amazon.com/Hasbro-Gaming-C1293-Clue-Junior/product-reviews/B01ISKSH2Q/ref=cm_cr_dp_d_show_all_btm?ie=UTF8&reviewerType=all_reviews","Emily Cutler","Good game, kid approved.","June 7, 2019","It was a bit confusing on how to move and which ways, but my kids seem to love it. 5 and 8 year olds.","4.0 out of 5 stars","Next page→","https://www.amazon.com/Hasbro-Gaming-C1293-Clue-Junior/product-reviews/B01ISKSH2Q/ref=cm_cr_arp_d_paging_btm_11?ie=UTF8&pageNumber=11&reviewerType=all_reviews"
"1574322800-10439","https://www.amazon.com/Hasbro-Gaming-C1293-Clue-Junior/product-reviews/B01ISKSH2Q/ref=cm_cr_dp_d_show_all_btm?ie=UTF8&reviewerType=all_reviews","Rob Goblin","Eh...","January 16, 2019","My 5 year old recently got into board games so we have been making the rounds of the old favorites. He asked about Clue and we tried to use the regular version but it was over his head. So we purchased Clue JR as an entry level version for him. There's a set up that took me about 20 minutes and then about 30 more minutes of reading the rules. I had assumed the instructions would be intended for a 5 year old they are overly worded and make the entire process harder than it needs to be. I'm trying to set up a game, learn the game, teach the game and all while my child is insanely excited over me. Most Junior games we have tried have been very abbreviated and require little set up. While the game was fun it caused unneeded anxiety in the process. I would've had an easier time just making up some rules for the regular Clue game and just rolling with it.","3.0 out of 5 stars","",""
"1574322800-10436","https://www.amazon.com/Hasbro-Gaming-C1293-Clue-Junior/product-reviews/B01ISKSH2Q/ref=cm_cr_dp_d_show_all_btm?ie=UTF8&reviewerType=all_reviews","CAMcMama","Fun, non-murderous Clue game.","September 12, 2017","This game is just as fun as the original, but I didn't want the murder part in my home for my kids.  They are trying to find out who ate the last piece of cake, with which drink, and at what time.  :-)  It is fun and we play it over and over.  My four year old is barely able to play it.  She is getting the hang of crossing off the things on the list when she sees them under the items on the board. She doesn't need to be able to read for this very much.","5.0 out of 5 stars","",""
"1574322838-10600","https://www.amazon.com/Hasbro-Gaming-C1293-Clue-Junior/product-reviews/B01ISKSH2Q/ref=cm_cr_dp_d_show_all_btm?ie=UTF8&reviewerType=all_reviews","Stephanie Warlik","Fun game","April 1, 2018","Super fun game.  Great modification for kids of the original game.","5.0 out of 5 stars","Next page→","https://www.amazon.com/Hasbro-Gaming-C1293-Clue-Junior/product-reviews/B01ISKSH2Q/ref=cm_cr_arp_d_paging_btm_18?ie=UTF8&pageNumber=18&reviewerType=all_reviews"
"1574322809-10474","https://www.amazon.com/Hasbro-Gaming-C1293-Clue-Junior/product-reviews/B01ISKSH2Q/ref=cm_cr_dp_d_show_all_btm?ie=UTF8&reviewerType=all_reviews","Boomer Gal","TOO confusion and tedious to assemble","October 7, 2017","I found the game confusing and tedious to assemble correctly.  I finally got it done (still not correctly I realized later), and played a round with my 5-year-old granddaughter.  She never did understand what was going on, and when I asked her if she wanted to play again, she said no.  Let's say this version ISN'T the old version which I loved.  Or maybe you just need to be old enough to play the original game to really enjoy the concept.","2.0 out of 5 stars","Next page→","https://www.amazon.com/Hasbro-Gaming-C1293-Clue-Junior/product-reviews/B01ISKSH2Q/ref=cm_cr_arp_d_paging_btm_5?ie=UTF8&pageNumber=5&reviewerType=all_reviews"
"1574322856-10688","https://www.amazon.com/Hasbro-Gaming-C1293-Clue-Junior/product-reviews/B01ISKSH2Q/ref=cm_cr_dp_d_show_all_btm?ie=UTF8&reviewerType=all_reviews","Elle","Missing pieces????","August 17, 2017","The game looks terrific. We were so excited to play with it. It arrived sealed and crisp. But when we opened it up, it had no white tokens and no die.
:(  I've never bought a new board game and found pieces missing before. It's useless.","1.0 out of 5 stars","Next page→","https://www.amazon.com/Hasbro-Gaming-C1293-Clue-Junior/product-reviews/B01ISKSH2Q/ref=cm_cr_arp_d_paging_btm_26?ie=UTF8&pageNumber=26&reviewerType=all_reviews"
"1574322807-10462","https://www.amazon.com/Hasbro-Gaming-C1293-Clue-Junior/product-reviews/B01ISKSH2Q/ref=cm_cr_dp_d_show_all_btm?ie=UTF8&reviewerType=all_reviews","Apple","Kids love it","January 12, 2019","My kids got this game for Christmas and love playing it.  It can be played over and over.  I love the cute characters with the game.","5.0 out of 5 stars","Next page→","https://www.amazon.com/Hasbro-Gaming-C1293-Clue-Junior/product-reviews/B01ISKSH2Q/ref=cm_cr_arp_d_paging_btm_4?ie=UTF8&pageNumber=4&reviewerType=all_reviews"
"1574322802-10440","https://www.amazon.com/Hasbro-Gaming-C1293-Clue-Junior/product-reviews/B01ISKSH2Q/ref=cm_cr_dp_d_show_all_btm?ie=UTF8&reviewerType=all_reviews","Travis Illig","Great intro to Clue and deductive reasoning","May 20, 2019","I picked this up for my eight-year-old and she loves it. It definitely plays a bit differently than original Clue. Instead of cards, you move tokens around the board and the clues are on the bottoms of the tokens. Land on a specific spot, you can look at the bottom (secretly) and mark info off your note pad.

There's less you can infer here. With regular clue, you can see what people have and what they don't based on who shows a card (or doesn't). With this kid's version, you pretty much have to see all the clues yourself in order to figure it out unless you want to make a total guess. That's not a bad thing, it's just less complicated and means games can go on maybe longer than you might anticipate.

The kiddo loves it, though, and it gets her thinking and interacting, which is good.

There are a couple of minor drawbacks that I didn't really deduct points on:

1. You don't move one specific character, you pick any character and move them. This may mean one player spends a turn or two trying to get a character to a specific spot and then some other player ""steals"" it and makes the final move to see the bottom of the character. You can address this with some ""house rules"" maybe or potentially consider it strategy - I can effectively stop you from looking at a character by ""stealing"" it and moving it away from the spot you want it.

2. The characters sit in these little white bases. Each base has the clue on the bottom. You switch up the bases (blindly) each game. However, it can be sort of tough to get the characters in the base, and if you don't get them in exactly they slip out easily, which can cause for some frustration mid-game.

3. It's pretty easy to knock the characters and other pieces over with little arms and hands reaching all over. If you knock one over, you see the bottom... and that's where the clue is. In some cases, ""accidents"" end up amounting to ""cheating"" because it reveals info that shouldn't have been revealed. Once is an accident, two or three times in the same game... hmmm....

In all, though, it's good. I can't wait until we graduate to the original Clue.","5.0 out of 5 stars","Next page→","https://www.amazon.com/Hasbro-Gaming-C1293-Clue-Junior/product-reviews/B01ISKSH2Q/ref=cm_cr_arp_d_paging_btm_2?ie=UTF8&pageNumber=2&reviewerType=all_reviews"
"1574322849-10652","https://www.amazon.com/Hasbro-Gaming-C1293-Clue-Junior/product-reviews/B01ISKSH2Q/ref=cm_cr_dp_d_show_all_btm?ie=UTF8&reviewerType=all_reviews","Phyllis Apple","Five Stars","January 25, 2018","my gransdon loved it.","5.0 out of 5 stars","Next page→","https://www.amazon.com/Hasbro-Gaming-C1293-Clue-Junior/product-reviews/B01ISKSH2Q/ref=cm_cr_arp_d_paging_btm_23?ie=UTF8&pageNumber=23&reviewerType=all_reviews"
"1574322858-10699","https://www.amazon.com/Hasbro-Gaming-C1293-Clue-Junior/product-reviews/B01ISKSH2Q/ref=cm_cr_dp_d_show_all_btm?ie=UTF8&reviewerType=all_reviews","Amazon Customer","We had such a great time playing the game with him","April 29, 2017","Bought this for my 6 year old grandson.  We had such a great time playing the game with him.","5.0 out of 5 stars","Next page→","https://www.amazon.com/Hasbro-Gaming-C1293-Clue-Junior/product-reviews/B01ISKSH2Q/ref=cm_cr_arp_d_paging_btm_27?ie=UTF8&pageNumber=27&reviewerType=all_reviews"
"1574322822-10533","https://www.amazon.com/Hasbro-Gaming-C1293-Clue-Junior/product-reviews/B01ISKSH2Q/ref=cm_cr_dp_d_show_all_btm?ie=UTF8&reviewerType=all_reviews","Gabriel Jones","Clue","February 15, 2019","Very nice kid friendly game with the same mystery feeling the original has but without the ""Murder"" aspect.","5.0 out of 5 stars","Next page→","https://www.amazon.com/Hasbro-Gaming-C1293-Clue-Junior/product-reviews/B01ISKSH2Q/ref=cm_cr_arp_d_paging_btm_11?ie=UTF8&pageNumber=11&reviewerType=all_reviews"
"1574322836-10596","https://www.amazon.com/Hasbro-Gaming-C1293-Clue-Junior/product-reviews/B01ISKSH2Q/ref=cm_cr_dp_d_show_all_btm?ie=UTF8&reviewerType=all_reviews","MGF2013","Great for kids and fun for adults","June 23, 2019","Super cute version of the original that’s super easy to learn and play.. my six year olds favorite choice for game night.","5.0 out of 5 stars","Next page→","https://www.amazon.com/Hasbro-Gaming-C1293-Clue-Junior/product-reviews/B01ISKSH2Q/ref=cm_cr_arp_d_paging_btm_17?ie=UTF8&pageNumber=17&reviewerType=all_reviews"
"1574322818-10516","https://www.amazon.com/Hasbro-Gaming-C1293-Clue-Junior/product-reviews/B01ISKSH2Q/ref=cm_cr_dp_d_show_all_btm?ie=UTF8&reviewerType=all_reviews","Amber Nelson","5 and 7 year olds loved it!","March 8, 2019","My 5 and 7 year old played this with me, and they loved it! It is a lot of fun to all play together!","5.0 out of 5 stars","Next page→","https://www.amazon.com/Hasbro-Gaming-C1293-Clue-Junior/product-reviews/B01ISKSH2Q/ref=cm_cr_arp_d_paging_btm_9?ie=UTF8&pageNumber=9&reviewerType=all_reviews"
"1574322861-10708","https://www.amazon.com/Hasbro-Gaming-C1293-Clue-Junior/product-reviews/B01ISKSH2Q/ref=cm_cr_dp_d_show_all_btm?ie=UTF8&reviewerType=all_reviews","Evangeline Anderson","Boring and confusing","November 27, 2017","This version of Clue is watered down, unnecessarily complicated and extremely boring.  I remember playing the original game when I was a kid and loving it. I don’t know why Hasbro felt the need to change it so drastically. Cannot recommend.","1.0 out of 5 stars","Next page→","https://www.amazon.com/Hasbro-Gaming-C1293-Clue-Junior/product-reviews/B01ISKSH2Q/ref=cm_cr_arp_d_paging_btm_28?ie=UTF8&pageNumber=28&reviewerType=all_reviews"
"1574322861-10701","https://www.amazon.com/Hasbro-Gaming-C1293-Clue-Junior/product-reviews/B01ISKSH2Q/ref=cm_cr_dp_d_show_all_btm?ie=UTF8&reviewerType=all_reviews","mary","Four Stars","May 2, 2017","Good game.","4.0 out of 5 stars","Next page→","https://www.amazon.com/Hasbro-Gaming-C1293-Clue-Junior/product-reviews/B01ISKSH2Q/ref=cm_cr_arp_d_paging_btm_28?ie=UTF8&pageNumber=28&reviewerType=all_reviews"
"1574322822-10539","https://www.amazon.com/Hasbro-Gaming-C1293-Clue-Junior/product-reviews/B01ISKSH2Q/ref=cm_cr_dp_d_show_all_btm?ie=UTF8&reviewerType=all_reviews","Sue","Not so good","January 15, 2019","Christmas gift for my 6 yr old grandson.  Not thrilled with the characters on the stands. Keep falling off.  Seemed cheap.","2.0 out of 5 stars","Next page→","https://www.amazon.com/Hasbro-Gaming-C1293-Clue-Junior/product-reviews/B01ISKSH2Q/ref=cm_cr_arp_d_paging_btm_11?ie=UTF8&pageNumber=11&reviewerType=all_reviews"
"1574322854-10672","https://www.amazon.com/Hasbro-Gaming-C1293-Clue-Junior/product-reviews/B01ISKSH2Q/ref=cm_cr_dp_d_show_all_btm?ie=UTF8&reviewerType=all_reviews","Tasha Licence","As expected","November 9, 2018","Perfect just what I expected","5.0 out of 5 stars","Next page→","https://www.amazon.com/Hasbro-Gaming-C1293-Clue-Junior/product-reviews/B01ISKSH2Q/ref=cm_cr_arp_d_paging_btm_25?ie=UTF8&pageNumber=25&reviewerType=all_reviews"
"1574322836-10598","https://www.amazon.com/Hasbro-Gaming-C1293-Clue-Junior/product-reviews/B01ISKSH2Q/ref=cm_cr_dp_d_show_all_btm?ie=UTF8&reviewerType=all_reviews","Danay","Disappointed","January 25, 2018","Didn't come with all of the pieces","1.0 out of 5 stars","Next page→","https://www.amazon.com/Hasbro-Gaming-C1293-Clue-Junior/product-reviews/B01ISKSH2Q/ref=cm_cr_arp_d_paging_btm_17?ie=UTF8&pageNumber=17&reviewerType=all_reviews"
"1574322827-10559","https://www.amazon.com/Hasbro-Gaming-C1293-Clue-Junior/product-reviews/B01ISKSH2Q/ref=cm_cr_dp_d_show_all_btm?ie=UTF8&reviewerType=all_reviews","Ox1904","Missing Pieces...","June 25, 2019","Missing all the white pieces and dice. Should have read the reviews, doesn’t seem to be a one-off issues as it’s happened to many others.  Hopefully I can get a replacement with no issues.","1.0 out of 5 stars","Next page→","https://www.amazon.com/Hasbro-Gaming-C1293-Clue-Junior/product-reviews/B01ISKSH2Q/ref=cm_cr_arp_d_paging_btm_13?ie=UTF8&pageNumber=13&reviewerType=all_reviews"
"1574322849-10653","https://www.amazon.com/Hasbro-Gaming-C1293-Clue-Junior/product-reviews/B01ISKSH2Q/ref=cm_cr_dp_d_show_all_btm?ie=UTF8&reviewerType=all_reviews","spartacus","who?","January 21, 2018","I have no idea","4.0 out of 5 stars","Next page→","https://www.amazon.com/Hasbro-Gaming-C1293-Clue-Junior/product-reviews/B01ISKSH2Q/ref=cm_cr_arp_d_paging_btm_23?ie=UTF8&pageNumber=23&reviewerType=all_reviews"
"1574322811-10483","https://www.amazon.com/Hasbro-Gaming-C1293-Clue-Junior/product-reviews/B01ISKSH2Q/ref=cm_cr_dp_d_show_all_btm?ie=UTF8&reviewerType=all_reviews","irene","Fun for the family!","January 31, 2018","Fun family game!! We play with out 8 year old and 4 year old. They love it! It was a little confusing to figure out in the beginning. The rules are different from regular Clue, and a tad confusing. After a trial game, we quickly figured everything out!","4.0 out of 5 stars","Next page→","https://www.amazon.com/Hasbro-Gaming-C1293-Clue-Junior/product-reviews/B01ISKSH2Q/ref=cm_cr_arp_d_paging_btm_6?ie=UTF8&pageNumber=6&reviewerType=all_reviews"
