web-scraper-order,web-scraper-start-url,author,title,date,content,rating,next,next-href
"1574322838-10605","https://www.amazon.com/Hasbro-Gaming-C1293-Clue-Junior/product-reviews/B01ISKSH2Q/ref=cm_cr_dp_d_show_all_btm?ie=UTF8&reviewerType=all_reviews","mh","Favorite as a kid....","December 1, 2018","Fun game. Kids will enjoy!","5.0 out of 5 stars","Next page→","https://www.amazon.com/Hasbro-Gaming-C1293-Clue-Junior/product-reviews/B01ISKSH2Q/ref=cm_cr_arp_d_paging_btm_18?ie=UTF8&pageNumber=18&reviewerType=all_reviews"
"1574322827-10558","https://www.amazon.com/Hasbro-Gaming-C1293-Clue-Junior/product-reviews/B01ISKSH2Q/ref=cm_cr_dp_d_show_all_btm?ie=UTF8&reviewerType=all_reviews","Bug mumma","My kids new favorite game","July 25, 2019","Kid is 4 and loves this","5.0 out of 5 stars","Next page→","https://www.amazon.com/Hasbro-Gaming-C1293-Clue-Junior/product-reviews/B01ISKSH2Q/ref=cm_cr_arp_d_paging_btm_13?ie=UTF8&pageNumber=13&reviewerType=all_reviews"
"1574322842-10626","https://www.amazon.com/Hasbro-Gaming-C1293-Clue-Junior/product-reviews/B01ISKSH2Q/ref=cm_cr_dp_d_show_all_btm?ie=UTF8&reviewerType=all_reviews","Fitz","Perfect game to play with children","January 11, 2018","My grandchildren loved playing this game. It has become a family favorite.","5.0 out of 5 stars","Next page→","https://www.amazon.com/Hasbro-Gaming-C1293-Clue-Junior/product-reviews/B01ISKSH2Q/ref=cm_cr_arp_d_paging_btm_20?ie=UTF8&pageNumber=20&reviewerType=all_reviews"
"1574322829-10563","https://www.amazon.com/Hasbro-Gaming-C1293-Clue-Junior/product-reviews/B01ISKSH2Q/ref=cm_cr_dp_d_show_all_btm?ie=UTF8&reviewerType=all_reviews","Cuttinos","Fun spin on original clue","October 28, 2019","Mysterious and fun","5.0 out of 5 stars","Next page→","https://www.amazon.com/Hasbro-Gaming-C1293-Clue-Junior/product-reviews/B01ISKSH2Q/ref=cm_cr_arp_d_paging_btm_14?ie=UTF8&pageNumber=14&reviewerType=all_reviews"
"1574322847-10644","https://www.amazon.com/Hasbro-Gaming-C1293-Clue-Junior/product-reviews/B01ISKSH2Q/ref=cm_cr_dp_d_show_all_btm?ie=UTF8&reviewerType=all_reviews","Melissa Steele","Missing game pieces","December 27, 2018","This game cAme as Christmas gift abd was missing half of the pieces!  I’m beyond disappointed as there is no way of playing it ahd my daughter was very sad","1.0 out of 5 stars","Next page→","https://www.amazon.com/Hasbro-Gaming-C1293-Clue-Junior/product-reviews/B01ISKSH2Q/ref=cm_cr_arp_d_paging_btm_22?ie=UTF8&pageNumber=22&reviewerType=all_reviews"
"1574322802-10445","https://www.amazon.com/Hasbro-Gaming-C1293-Clue-Junior/product-reviews/B01ISKSH2Q/ref=cm_cr_dp_d_show_all_btm?ie=UTF8&reviewerType=all_reviews","idaho dawn","The worst version of this game","December 23, 2018","The concept of how clues are hidden is flawed. All clues are on the bottom of characters. When you move a pawn, you easily knock over others or tip the pawn and show others. Especially with children. We want to burn this game after one round of constant frustration. Don’t waste your money on this. Get the old spy version!","1.0 out of 5 stars","Next page→","https://www.amazon.com/Hasbro-Gaming-C1293-Clue-Junior/product-reviews/B01ISKSH2Q/ref=cm_cr_arp_d_paging_btm_2?ie=UTF8&pageNumber=2&reviewerType=all_reviews"
"1574322813-10496","https://www.amazon.com/Hasbro-Gaming-C1293-Clue-Junior/product-reviews/B01ISKSH2Q/ref=cm_cr_dp_d_show_all_btm?ie=UTF8&reviewerType=all_reviews","AMS","disappointed","August 7, 2019","This is a fun game. Very cute pictures and board. Game pieces will not stay on characters during play. I also feel maybe age should be a little higher then 5.","3.0 out of 5 stars","Next page→","https://www.amazon.com/Hasbro-Gaming-C1293-Clue-Junior/product-reviews/B01ISKSH2Q/ref=cm_cr_arp_d_paging_btm_7?ie=UTF8&pageNumber=7&reviewerType=all_reviews"
"1574322858-10696","https://www.amazon.com/Hasbro-Gaming-C1293-Clue-Junior/product-reviews/B01ISKSH2Q/ref=cm_cr_dp_d_show_all_btm?ie=UTF8&reviewerType=all_reviews","SAELCO","It's great! My 5 year old son loves it","April 1, 2017","It's great!  My 5 year old son loves it!","5.0 out of 5 stars","Next page→","https://www.amazon.com/Hasbro-Gaming-C1293-Clue-Junior/product-reviews/B01ISKSH2Q/ref=cm_cr_arp_d_paging_btm_27?ie=UTF8&pageNumber=27&reviewerType=all_reviews"
"1574322820-10524","https://www.amazon.com/Hasbro-Gaming-C1293-Clue-Junior/product-reviews/B01ISKSH2Q/ref=cm_cr_dp_d_show_all_btm?ie=UTF8&reviewerType=all_reviews","Sunshine","Fun game for the whole family!","November 12, 2019","Review of an 8 year old boy:
Fun playing with my family. I liked solving the mystery.","5.0 out of 5 stars","Next page→","https://www.amazon.com/Hasbro-Gaming-C1293-Clue-Junior/product-reviews/B01ISKSH2Q/ref=cm_cr_arp_d_paging_btm_10?ie=UTF8&pageNumber=10&reviewerType=all_reviews"
"1574322824-10544","https://www.amazon.com/Hasbro-Gaming-C1293-Clue-Junior/product-reviews/B01ISKSH2Q/ref=cm_cr_dp_d_show_all_btm?ie=UTF8&reviewerType=all_reviews","gmb","Read and reread the directions before you play","March 30, 2019","It’s a cute game but considering it’s meant for kids, it’s a bit confusing the first several times you play.","3.0 out of 5 stars","Next page→","https://www.amazon.com/Hasbro-Gaming-C1293-Clue-Junior/product-reviews/B01ISKSH2Q/ref=cm_cr_arp_d_paging_btm_12?ie=UTF8&pageNumber=12&reviewerType=all_reviews"
"1574322802-10443","https://www.amazon.com/Hasbro-Gaming-C1293-Clue-Junior/product-reviews/B01ISKSH2Q/ref=cm_cr_dp_d_show_all_btm?ie=UTF8&reviewerType=all_reviews","Paul","Fun for kids AND adults!","April 3, 2018","My 6 year old daughter LOVES this game. It’s one of those games that we don’t mind playing with her because it has some strategy involved and we can legitimately play to win (or lose) - and she has beat us fair and square quite a few times already. We figure that the game play for 3 players takes about 20-25 minutes, which is not too long but not too short either. I highly recommend this game for a family game night.","5.0 out of 5 stars","Next page→","https://www.amazon.com/Hasbro-Gaming-C1293-Clue-Junior/product-reviews/B01ISKSH2Q/ref=cm_cr_arp_d_paging_btm_2?ie=UTF8&pageNumber=2&reviewerType=all_reviews"
"1574322804-10457","https://www.amazon.com/Hasbro-Gaming-C1293-Clue-Junior/product-reviews/B01ISKSH2Q/ref=cm_cr_dp_d_show_all_btm?ie=UTF8&reviewerType=all_reviews","KDawgTeach","Disappointed in the Fun Level","February 2, 2018","Packaging was great, and delivery was fast. We were looking for a new game to play with our son, and thought this would be a fun game, but we were disappointed. The directions to play were somewhat confusing, and we had to constantly refer back to them because we were unsure about steps. Putting the correct labels and stickers on the plastic pieces was easy to do, but the directions were not perfectly clear. We played the game, and it was actually boring—not what we anticipated at all. Our son wanted to stop playing after just a couple minutes.","3.0 out of 5 stars","Next page→","https://www.amazon.com/Hasbro-Gaming-C1293-Clue-Junior/product-reviews/B01ISKSH2Q/ref=cm_cr_arp_d_paging_btm_3?ie=UTF8&pageNumber=3&reviewerType=all_reviews"
"1574322831-10571","https://www.amazon.com/Hasbro-Gaming-C1293-Clue-Junior/product-reviews/B01ISKSH2Q/ref=cm_cr_dp_d_show_all_btm?ie=UTF8&reviewerType=all_reviews","Mary M","Lots of fun for the kids.","September 28, 2019","Grandkids love this game.","5.0 out of 5 stars","Next page→","https://www.amazon.com/Hasbro-Gaming-C1293-Clue-Junior/product-reviews/B01ISKSH2Q/ref=cm_cr_arp_d_paging_btm_15?ie=UTF8&pageNumber=15&reviewerType=all_reviews"
"1574322816-10507","https://www.amazon.com/Hasbro-Gaming-C1293-Clue-Junior/product-reviews/B01ISKSH2Q/ref=cm_cr_dp_d_show_all_btm?ie=UTF8&reviewerType=all_reviews","Airsick Lowlander","Cumbersome to  set up and play","January 9, 2018","Pain in the rear to assemble each time. Play is cumbersome. Simply not fun. I play with my 5, 7, and 13 year old kids and they are miserable each time. Original clue is just so much better (and easier to play)","2.0 out of 5 stars","Next page→","https://www.amazon.com/Hasbro-Gaming-C1293-Clue-Junior/product-reviews/B01ISKSH2Q/ref=cm_cr_arp_d_paging_btm_8?ie=UTF8&pageNumber=8&reviewerType=all_reviews"
"1574322822-10535","https://www.amazon.com/Hasbro-Gaming-C1293-Clue-Junior/product-reviews/B01ISKSH2Q/ref=cm_cr_dp_d_show_all_btm?ie=UTF8&reviewerType=all_reviews","Amazon Customer","Boring.","June 23, 2019","Based mostly on luck. Was hoping this would teach my children deduction and a little problem solving. Unfortunately, it's just roll the die and get lucky.","2.0 out of 5 stars","Next page→","https://www.amazon.com/Hasbro-Gaming-C1293-Clue-Junior/product-reviews/B01ISKSH2Q/ref=cm_cr_arp_d_paging_btm_11?ie=UTF8&pageNumber=11&reviewerType=all_reviews"
"1574322809-10478","https://www.amazon.com/Hasbro-Gaming-C1293-Clue-Junior/product-reviews/B01ISKSH2Q/ref=cm_cr_dp_d_show_all_btm?ie=UTF8&reviewerType=all_reviews","Jazz","Harder than adult game.","September 6, 2018","Played with 4 adults and two 7 year olds. Confusing game.","2.0 out of 5 stars","Next page→","https://www.amazon.com/Hasbro-Gaming-C1293-Clue-Junior/product-reviews/B01ISKSH2Q/ref=cm_cr_arp_d_paging_btm_5?ie=UTF8&pageNumber=5&reviewerType=all_reviews"
"1574322854-10679","https://www.amazon.com/Hasbro-Gaming-C1293-Clue-Junior/product-reviews/B01ISKSH2Q/ref=cm_cr_dp_d_show_all_btm?ie=UTF8&reviewerType=all_reviews","Austin Willis","Five Stars","April 21, 2018","Way too complicated for a five year old","5.0 out of 5 stars","Next page→","https://www.amazon.com/Hasbro-Gaming-C1293-Clue-Junior/product-reviews/B01ISKSH2Q/ref=cm_cr_arp_d_paging_btm_25?ie=UTF8&pageNumber=25&reviewerType=all_reviews"
"1574322861-10707","https://www.amazon.com/Hasbro-Gaming-C1293-Clue-Junior/product-reviews/B01ISKSH2Q/ref=cm_cr_dp_d_show_all_btm?ie=UTF8&reviewerType=all_reviews","Marisa Fox","Cute but more confusing than necessary","December 3, 2018","I love Clue! I want to love Clue, Jr., but they made it more complicated than necessary. Monopoly Jr. rocks - they simplified it perfectly while still keeping the game intact.

First - the setup takes awhile - and the setup is kinda hard to do - think an older child or adult would have to help...each time the game is played.

Second - the game board could be more clean & simple. It's hard to look at - and the multiple spaces inside the rooms is unnecessary. I wish there were just basic blocks - instead of random footprints. And I wish that when you entered a room, you chose to land on a yellow or a white circle in each room. Period.

Third - I wish they included reusable laminated flip up cards with bigger, more clear pictures so you could more easily see the pictures and mark them off with a dry erase marker or washable marker.

This game has potential, but I was pretty disappointed at the details of the board and the play sheets. Who tested this? Huge red flags if you think a 5 - 7 year-old will be able to play it.","3.0 out of 5 stars","Next page→","https://www.amazon.com/Hasbro-Gaming-C1293-Clue-Junior/product-reviews/B01ISKSH2Q/ref=cm_cr_arp_d_paging_btm_28?ie=UTF8&pageNumber=28&reviewerType=all_reviews"
"1574322849-10659","https://www.amazon.com/Hasbro-Gaming-C1293-Clue-Junior/product-reviews/B01ISKSH2Q/ref=cm_cr_dp_d_show_all_btm?ie=UTF8&reviewerType=all_reviews","Amazon Customer","Worth the money!","December 25, 2017","Our 6 year old loved this game.  It is a little different than the original clue but definitely a great game for the family.","5.0 out of 5 stars","Next page→","https://www.amazon.com/Hasbro-Gaming-C1293-Clue-Junior/product-reviews/B01ISKSH2Q/ref=cm_cr_arp_d_paging_btm_23?ie=UTF8&pageNumber=23&reviewerType=all_reviews"
"1574322800-10438","https://www.amazon.com/Hasbro-Gaming-C1293-Clue-Junior/product-reviews/B01ISKSH2Q/ref=cm_cr_dp_d_show_all_btm?ie=UTF8&reviewerType=all_reviews","Kristin Burton","Confusing and awkward","October 15, 2018","What is the purpose of the furniture? It doesn’t play a role in the mystery and yet they put it on the paper. Also there isn’t a piece of furniture for every room. It just adds  confusion.  I feel like Hasbro dropped the ball on this game. Also the game pieces don’t sit well in the little coin things like they are supposed to and it’s really a pain. I’m so disappointed in this game.","1.0 out of 5 stars","",""
"1574322852-10665","https://www.amazon.com/Hasbro-Gaming-C1293-Clue-Junior/product-reviews/B01ISKSH2Q/ref=cm_cr_dp_d_show_all_btm?ie=UTF8&reviewerType=all_reviews","Kindle Customer","Great game","February 23, 2019","I bought this for my second grade classroom and the students love it!","5.0 out of 5 stars","Next page→","https://www.amazon.com/Hasbro-Gaming-C1293-Clue-Junior/product-reviews/B01ISKSH2Q/ref=cm_cr_arp_d_paging_btm_24?ie=UTF8&pageNumber=24&reviewerType=all_reviews"
"1574322842-10620","https://www.amazon.com/Hasbro-Gaming-C1293-Clue-Junior/product-reviews/B01ISKSH2Q/ref=cm_cr_dp_d_show_all_btm?ie=UTF8&reviewerType=all_reviews","Samayra","Excelente","December 4, 2018","Me encanta.. a mis Hijos y hijas le encantan esta version junior.","5.0 out of 5 stars","Next page→","https://www.amazon.com/Hasbro-Gaming-C1293-Clue-Junior/product-reviews/B01ISKSH2Q/ref=cm_cr_arp_d_paging_btm_20?ie=UTF8&pageNumber=20&reviewerType=all_reviews"
"1574322856-10686","https://www.amazon.com/Hasbro-Gaming-C1293-Clue-Junior/product-reviews/B01ISKSH2Q/ref=cm_cr_dp_d_show_all_btm?ie=UTF8&reviewerType=all_reviews","Ari Martin","Great Game!","February 12, 2019","I play this game with my children as well. I recommend this.","5.0 out of 5 stars","Next page→","https://www.amazon.com/Hasbro-Gaming-C1293-Clue-Junior/product-reviews/B01ISKSH2Q/ref=cm_cr_arp_d_paging_btm_26?ie=UTF8&pageNumber=26&reviewerType=all_reviews"
"1574322840-10619","https://www.amazon.com/Hasbro-Gaming-C1293-Clue-Junior/product-reviews/B01ISKSH2Q/ref=cm_cr_dp_d_show_all_btm?ie=UTF8&reviewerType=all_reviews","linda mize","I would certainly tell other people how nice it was.","February 15, 2019","loved it","5.0 out of 5 stars","Next page→","https://www.amazon.com/Hasbro-Gaming-C1293-Clue-Junior/product-reviews/B01ISKSH2Q/ref=cm_cr_arp_d_paging_btm_19?ie=UTF8&pageNumber=19&reviewerType=all_reviews"
"1574322804-10455","https://www.amazon.com/Hasbro-Gaming-C1293-Clue-Junior/product-reviews/B01ISKSH2Q/ref=cm_cr_dp_d_show_all_btm?ie=UTF8&reviewerType=all_reviews","nlh","This ism the 2nd game I have ordered and both ...","December 31, 2017","This ism the 2nd game I have ordered and both arrived missing the 7 white bases and the die.  It appears  the company packaging  the games is at fault,  Needless to say I will not order the game again.
Very frustrating as I was looking forward to playing the game with my grandchildren.","2.0 out of 5 stars","Next page→","https://www.amazon.com/Hasbro-Gaming-C1293-Clue-Junior/product-reviews/B01ISKSH2Q/ref=cm_cr_arp_d_paging_btm_3?ie=UTF8&pageNumber=3&reviewerType=all_reviews"
"1574322807-10466","https://www.amazon.com/Hasbro-Gaming-C1293-Clue-Junior/product-reviews/B01ISKSH2Q/ref=cm_cr_dp_d_show_all_btm?ie=UTF8&reviewerType=all_reviews","Amazon Customer","Great idea!","April 5, 2018","Clue is my favorite board game. The way they modified this for young children was clever! My four and six year old are both able to play on their own, but we enjoy it as adults as well. Great family game!","5.0 out of 5 stars","Next page→","https://www.amazon.com/Hasbro-Gaming-C1293-Clue-Junior/product-reviews/B01ISKSH2Q/ref=cm_cr_arp_d_paging_btm_4?ie=UTF8&pageNumber=4&reviewerType=all_reviews"
"1574322838-10604","https://www.amazon.com/Hasbro-Gaming-C1293-Clue-Junior/product-reviews/B01ISKSH2Q/ref=cm_cr_dp_d_show_all_btm?ie=UTF8&reviewerType=all_reviews","Latisha Record","good for all ages","January 26, 2018","My 6 kids range in age from 6 to 23.  We all had a good time playing this game.  It's a little different from the original Clue, so we had to get used to that change.  It was a little awkward at first.  But once we played a couple of times, that all went away and now we really enjoy it.","5.0 out of 5 stars","Next page→","https://www.amazon.com/Hasbro-Gaming-C1293-Clue-Junior/product-reviews/B01ISKSH2Q/ref=cm_cr_arp_d_paging_btm_18?ie=UTF8&pageNumber=18&reviewerType=all_reviews"
"1574322838-10607","https://www.amazon.com/Hasbro-Gaming-C1293-Clue-Junior/product-reviews/B01ISKSH2Q/ref=cm_cr_dp_d_show_all_btm?ie=UTF8&reviewerType=all_reviews","Cody","We talk!","January 10, 2018","A great way to spend time with a grandchild that requires conversation.","5.0 out of 5 stars","Next page→","https://www.amazon.com/Hasbro-Gaming-C1293-Clue-Junior/product-reviews/B01ISKSH2Q/ref=cm_cr_arp_d_paging_btm_18?ie=UTF8&pageNumber=18&reviewerType=all_reviews"
"1574322827-10555","https://www.amazon.com/Hasbro-Gaming-C1293-Clue-Junior/product-reviews/B01ISKSH2Q/ref=cm_cr_dp_d_show_all_btm?ie=UTF8&reviewerType=all_reviews","Britta","Missing pieces","January 26, 2018","This was a gift for my son after his surgery and when we opened it it was missing pieces (no white bases and no dice)! My son was so disappointed!","1.0 out of 5 stars","Next page→","https://www.amazon.com/Hasbro-Gaming-C1293-Clue-Junior/product-reviews/B01ISKSH2Q/ref=cm_cr_arp_d_paging_btm_13?ie=UTF8&pageNumber=13&reviewerType=all_reviews"
"1574322856-10685","https://www.amazon.com/Hasbro-Gaming-C1293-Clue-Junior/product-reviews/B01ISKSH2Q/ref=cm_cr_dp_d_show_all_btm?ie=UTF8&reviewerType=all_reviews","Amazon Customer","Great game","February 26, 2019",";)","5.0 out of 5 stars","Next page→","https://www.amazon.com/Hasbro-Gaming-C1293-Clue-Junior/product-reviews/B01ISKSH2Q/ref=cm_cr_arp_d_paging_btm_26?ie=UTF8&pageNumber=26&reviewerType=all_reviews"
"1574322824-10545","https://www.amazon.com/Hasbro-Gaming-C1293-Clue-Junior/product-reviews/B01ISKSH2Q/ref=cm_cr_dp_d_show_all_btm?ie=UTF8&reviewerType=all_reviews","smoghi","Awesome for kids too young to play clue","December 11, 2018","I loved CLUE as a kid, but my son is 5, and not old enough to fully grasp how to play. We love this game. Highly recommend.","5.0 out of 5 stars","Next page→","https://www.amazon.com/Hasbro-Gaming-C1293-Clue-Junior/product-reviews/B01ISKSH2Q/ref=cm_cr_arp_d_paging_btm_12?ie=UTF8&pageNumber=12&reviewerType=all_reviews"
"1574322820-10525","https://www.amazon.com/Hasbro-Gaming-C1293-Clue-Junior/product-reviews/B01ISKSH2Q/ref=cm_cr_dp_d_show_all_btm?ie=UTF8&reviewerType=all_reviews","Amazon Customer","Hard to follow","January 2, 2019","I’m kinda disappointed in this one. I’m not sure what I expected, they did make it appropriate for younger kids but we found it a little hard to follow. I’m not sure my kids knew what they were doing until after the game was over and they haven’t asked to play again (they LOVE games).","3.0 out of 5 stars","Next page→","https://www.amazon.com/Hasbro-Gaming-C1293-Clue-Junior/product-reviews/B01ISKSH2Q/ref=cm_cr_arp_d_paging_btm_10?ie=UTF8&pageNumber=10&reviewerType=all_reviews"
"1574322852-10664","https://www.amazon.com/Hasbro-Gaming-C1293-Clue-Junior/product-reviews/B01ISKSH2Q/ref=cm_cr_dp_d_show_all_btm?ie=UTF8&reviewerType=all_reviews","Dewayne A","👍🏿👍🏿","March 30, 2019","Kids love it","4.0 out of 5 stars","Next page→","https://www.amazon.com/Hasbro-Gaming-C1293-Clue-Junior/product-reviews/B01ISKSH2Q/ref=cm_cr_arp_d_paging_btm_24?ie=UTF8&pageNumber=24&reviewerType=all_reviews"
"1574322833-10582","https://www.amazon.com/Hasbro-Gaming-C1293-Clue-Junior/product-reviews/B01ISKSH2Q/ref=cm_cr_dp_d_show_all_btm?ie=UTF8&reviewerType=all_reviews","Ruth Belanger","Cute game!","June 9, 2019","Very cute game!  My kids like it a lot!","5.0 out of 5 stars","Next page→","https://www.amazon.com/Hasbro-Gaming-C1293-Clue-Junior/product-reviews/B01ISKSH2Q/ref=cm_cr_arp_d_paging_btm_16?ie=UTF8&pageNumber=16&reviewerType=all_reviews"
"1574322831-10574","https://www.amazon.com/Hasbro-Gaming-C1293-Clue-Junior/product-reviews/B01ISKSH2Q/ref=cm_cr_dp_d_show_all_btm?ie=UTF8&reviewerType=all_reviews","Tomas DellaMorte","Fun!","March 28, 2019","Excellent product at a great price! My daughter adores it!","5.0 out of 5 stars","Next page→","https://www.amazon.com/Hasbro-Gaming-C1293-Clue-Junior/product-reviews/B01ISKSH2Q/ref=cm_cr_arp_d_paging_btm_15?ie=UTF8&pageNumber=15&reviewerType=all_reviews"
"1574322824-10540","https://www.amazon.com/Hasbro-Gaming-C1293-Clue-Junior/product-reviews/B01ISKSH2Q/ref=cm_cr_dp_d_show_all_btm?ie=UTF8&reviewerType=all_reviews","Jean Denk","Great for 6 year olds!","January 10, 2019","My Granddaughter and I played for hours!  We had a ball!  Only fault I had is pieces are big and hard to fit all on the board.","5.0 out of 5 stars","Next page→","https://www.amazon.com/Hasbro-Gaming-C1293-Clue-Junior/product-reviews/B01ISKSH2Q/ref=cm_cr_arp_d_paging_btm_12?ie=UTF8&pageNumber=12&reviewerType=all_reviews"
"1574322811-10484","https://www.amazon.com/Hasbro-Gaming-C1293-Clue-Junior/product-reviews/B01ISKSH2Q/ref=cm_cr_dp_d_show_all_btm?ie=UTF8&reviewerType=all_reviews","S. Holden","Meh","December 30, 2018","My five year olds are unable to play the regular Clue game, so I was hoping this would be a good alternative. It is actually more difficult though. The directions are confusing, and the pieces do not stick together well. I would not recommend this game.","3.0 out of 5 stars","Next page→","https://www.amazon.com/Hasbro-Gaming-C1293-Clue-Junior/product-reviews/B01ISKSH2Q/ref=cm_cr_arp_d_paging_btm_6?ie=UTF8&pageNumber=6&reviewerType=all_reviews"
"1574322847-10648","https://www.amazon.com/Hasbro-Gaming-C1293-Clue-Junior/product-reviews/B01ISKSH2Q/ref=cm_cr_dp_d_show_all_btm?ie=UTF8&reviewerType=all_reviews","Amazon Customer","Cool game","December 26, 2018","Nephew loves games and this was a perfect one to add to his collection","5.0 out of 5 stars","Next page→","https://www.amazon.com/Hasbro-Gaming-C1293-Clue-Junior/product-reviews/B01ISKSH2Q/ref=cm_cr_arp_d_paging_btm_22?ie=UTF8&pageNumber=22&reviewerType=all_reviews"
"1574322838-10601","https://www.amazon.com/Hasbro-Gaming-C1293-Clue-Junior/product-reviews/B01ISKSH2Q/ref=cm_cr_dp_d_show_all_btm?ie=UTF8&reviewerType=all_reviews","C. Manchester","Five Stars","February 20, 2018","My grandson and his Mom play this many times","5.0 out of 5 stars","Next page→","https://www.amazon.com/Hasbro-Gaming-C1293-Clue-Junior/product-reviews/B01ISKSH2Q/ref=cm_cr_arp_d_paging_btm_18?ie=UTF8&pageNumber=18&reviewerType=all_reviews"
"1574322858-10698","https://www.amazon.com/Hasbro-Gaming-C1293-Clue-Junior/product-reviews/B01ISKSH2Q/ref=cm_cr_dp_d_show_all_btm?ie=UTF8&reviewerType=all_reviews","CT","Classic game appropriate for kids","July 16, 2017","My son had been begging to play clue, but he's only 5 and we didn't want him to play the classic version. Clue Jr is perfect for young kids! My son loves solving the mystery of who ate the cake. My only criticism is that the pieces sometimes fall off when checking the characters. A few times we had to start the game over because of this. Overall great game!","4.0 out of 5 stars","Next page→","https://www.amazon.com/Hasbro-Gaming-C1293-Clue-Junior/product-reviews/B01ISKSH2Q/ref=cm_cr_arp_d_paging_btm_27?ie=UTF8&pageNumber=27&reviewerType=all_reviews"
"1574322816-10502","https://www.amazon.com/Hasbro-Gaming-C1293-Clue-Junior/product-reviews/B01ISKSH2Q/ref=cm_cr_dp_d_show_all_btm?ie=UTF8&reviewerType=all_reviews","Nicole","Such a great family game","April 3, 2019","Great game! Not easy for a 5-6 year old so we made a couple of adjustments to the rules where we solve as a team instead of individuals. My 7 year old LOVES this game!","5.0 out of 5 stars","Next page→","https://www.amazon.com/Hasbro-Gaming-C1293-Clue-Junior/product-reviews/B01ISKSH2Q/ref=cm_cr_arp_d_paging_btm_8?ie=UTF8&pageNumber=8&reviewerType=all_reviews"
"1574322807-10467","https://www.amazon.com/Hasbro-Gaming-C1293-Clue-Junior/product-reviews/B01ISKSH2Q/ref=cm_cr_dp_d_show_all_btm?ie=UTF8&reviewerType=all_reviews","Kinner Family","Fun but too easy to play great for kids only not a family game night game","March 4, 2019","This is definitely a junior version not very entertaining, very easy to play. I wish I would have paid attention to it being a junior and read the how to play first because it is very simple and too easy for adults. You literally almost have to pretend you dont know puzzle so you don't beat your kid every single time.","5.0 out of 5 stars","Next page→","https://www.amazon.com/Hasbro-Gaming-C1293-Clue-Junior/product-reviews/B01ISKSH2Q/ref=cm_cr_arp_d_paging_btm_4?ie=UTF8&pageNumber=4&reviewerType=all_reviews"
"1574322833-10587","https://www.amazon.com/Hasbro-Gaming-C1293-Clue-Junior/product-reviews/B01ISKSH2Q/ref=cm_cr_dp_d_show_all_btm?ie=UTF8&reviewerType=all_reviews","Jetsss","As good as it gets","January 28, 2019","Truly a great classic game in junior edition. Fun for everyone","5.0 out of 5 stars","Next page→","https://www.amazon.com/Hasbro-Gaming-C1293-Clue-Junior/product-reviews/B01ISKSH2Q/ref=cm_cr_arp_d_paging_btm_16?ie=UTF8&pageNumber=16&reviewerType=all_reviews"
"1574322822-10537","https://www.amazon.com/Hasbro-Gaming-C1293-Clue-Junior/product-reviews/B01ISKSH2Q/ref=cm_cr_dp_d_show_all_btm?ie=UTF8&reviewerType=all_reviews","aaron cross","Wonderful!","October 22, 2019","This is a great game and was a wonderful gift for my nephews.","5.0 out of 5 stars","Next page→","https://www.amazon.com/Hasbro-Gaming-C1293-Clue-Junior/product-reviews/B01ISKSH2Q/ref=cm_cr_arp_d_paging_btm_11?ie=UTF8&pageNumber=11&reviewerType=all_reviews"
