web-scraper-order,web-scraper-start-url,author,title,date,content,rating,next,next-href
"1574329513-11603","https://www.amazon.com/Becoming-2015-Geovanni-Molina/product-reviews/B00M5KODWO/ref=cm_cr_dp_d_show_all_btm?ie=UTF8&reviewerType=all_reviews","Hope Sanchez","Waste of time","June 10, 2015","just....no","1.0 out of 5 stars","Next page→","https://www.amazon.com/Becoming-2015-Geovanni-Molina/product-reviews/B00M5KODWO/ref=cm_cr_arp_d_paging_btm_45?ie=UTF8&pageNumber=45&reviewerType=all_reviews"
"1574329453-11341","https://www.amazon.com/Becoming-2015-Geovanni-Molina/product-reviews/B00M5KODWO/ref=cm_cr_dp_d_show_all_btm?ie=UTF8&reviewerType=all_reviews","Angie","Stopped watching it after 20 minutes.","May 22, 2016","Horrible","1.0 out of 5 stars","Next page→","https://www.amazon.com/Becoming-2015-Geovanni-Molina/product-reviews/B00M5KODWO/ref=cm_cr_arp_d_paging_btm_18?ie=UTF8&pageNumber=18&reviewerType=all_reviews"
"1574329502-11559","https://www.amazon.com/Becoming-2015-Geovanni-Molina/product-reviews/B00M5KODWO/ref=cm_cr_dp_d_show_all_btm?ie=UTF8&reviewerType=all_reviews","Anime","One Star","July 6, 2016","Never watch a movie with the year in it.","1.0 out of 5 stars","Next page→","https://www.amazon.com/Becoming-2015-Geovanni-Molina/product-reviews/B00M5KODWO/ref=cm_cr_arp_d_paging_btm_40?ie=UTF8&pageNumber=40&reviewerType=all_reviews"
"1574329436-11266","https://www.amazon.com/Becoming-2015-Geovanni-Molina/product-reviews/B00M5KODWO/ref=cm_cr_dp_d_show_all_btm?ie=UTF8&reviewerType=all_reviews","Mark Bennett","Don't bother with this turkey.","August 9, 2016","Watched for about a half hour and then gave up could not figure out what the heck was going on.","1.0 out of 5 stars","Next page→","https://www.amazon.com/Becoming-2015-Geovanni-Molina/product-reviews/B00M5KODWO/ref=cm_cr_arp_d_paging_btm_11?ie=UTF8&pageNumber=11&reviewerType=all_reviews"
"1574329509-11591","https://www.amazon.com/Becoming-2015-Geovanni-Molina/product-reviews/B00M5KODWO/ref=cm_cr_dp_d_show_all_btm?ie=UTF8&reviewerType=all_reviews","Mariana Ramos","One Star","August 24, 2015","What a horrible mistake, such an awful movie.","1.0 out of 5 stars","Next page→","https://www.amazon.com/Becoming-2015-Geovanni-Molina/product-reviews/B00M5KODWO/ref=cm_cr_arp_d_paging_btm_43?ie=UTF8&pageNumber=43&reviewerType=all_reviews"
"1574329530-11674","https://www.amazon.com/Becoming-2015-Geovanni-Molina/product-reviews/B00M5KODWO/ref=cm_cr_dp_d_show_all_btm?ie=UTF8&reviewerType=all_reviews","Trei Jackson","One Star","February 16, 2015","Bad bad B movie","1.0 out of 5 stars","Next page→","https://www.amazon.com/Becoming-2015-Geovanni-Molina/product-reviews/B00M5KODWO/ref=cm_cr_arp_d_paging_btm_52?ie=UTF8&pageNumber=52&reviewerType=all_reviews"
"1574329469-11410","https://www.amazon.com/Becoming-2015-Geovanni-Molina/product-reviews/B00M5KODWO/ref=cm_cr_dp_d_show_all_btm?ie=UTF8&reviewerType=all_reviews","Weiss","The best of the worst","August 2, 2015","I think this is misclassified. It is definitely a comedy, spoof style.

I fell asleep twice. The first time I rewound;  the second time I didn't. There were too many scenes that to me, suggested intentional comedy, that I stopped thinking there was a logical story even attempted here, so I just enjoyed what I could and grimaced through the rest.

You get it all folks. I think a couple of beers or similar would go a long way toward improving things. A couple naps help too!","5.0 out of 5 stars","Next page→","https://www.amazon.com/Becoming-2015-Geovanni-Molina/product-reviews/B00M5KODWO/ref=cm_cr_arp_d_paging_btm_25?ie=UTF8&pageNumber=25&reviewerType=all_reviews"
"1574329444-11295","https://www.amazon.com/Becoming-2015-Geovanni-Molina/product-reviews/B00M5KODWO/ref=cm_cr_dp_d_show_all_btm?ie=UTF8&reviewerType=all_reviews","Tim H.","Its a complete waste of storage and bandwidth","September 1, 2014","Stay well away from this.  I don't care if your just gonna kill time.  I could not make it 15 minutes into this.  This is typical free Amazon movie fodder.  Its a complete waste of storage and bandwidth.  If there was a zero rating, this would be in that class.  Why is it even in Sci-Fi section?  Just because of some random space shots?  Starting to think the cost of Prime free movies ain't worth it anymore.....","1.0 out of 5 stars","Next page→","https://www.amazon.com/Becoming-2015-Geovanni-Molina/product-reviews/B00M5KODWO/ref=cm_cr_arp_d_paging_btm_14?ie=UTF8&pageNumber=14&reviewerType=all_reviews"
"1574329520-11635","https://www.amazon.com/Becoming-2015-Geovanni-Molina/product-reviews/B00M5KODWO/ref=cm_cr_dp_d_show_all_btm?ie=UTF8&reviewerType=all_reviews","Amazon Customer","One Star","May 9, 2016","bad","1.0 out of 5 stars","Next page→","https://www.amazon.com/Becoming-2015-Geovanni-Molina/product-reviews/B00M5KODWO/ref=cm_cr_arp_d_paging_btm_48?ie=UTF8&pageNumber=48&reviewerType=all_reviews"
"1574329446-11302","https://www.amazon.com/Becoming-2015-Geovanni-Molina/product-reviews/B00M5KODWO/ref=cm_cr_dp_d_show_all_btm?ie=UTF8&reviewerType=all_reviews","Beverly","Two Stars","July 16, 2016","Not interest in this kind of movie.","2.0 out of 5 stars","Next page→","https://www.amazon.com/Becoming-2015-Geovanni-Molina/product-reviews/B00M5KODWO/ref=cm_cr_arp_d_paging_btm_15?ie=UTF8&pageNumber=15&reviewerType=all_reviews"
"1574329425-11219","https://www.amazon.com/Becoming-2015-Geovanni-Molina/product-reviews/B00M5KODWO/ref=cm_cr_dp_d_show_all_btm?ie=UTF8&reviewerType=all_reviews","Jose B.","don't waste your time","June 13, 2015","don't waste your time. i would give it negative stars i it was an option. this movie is bad all around. bad acting, script, directing, story, did i mention bad acting. like one of the other reviewers said ""cheap porn, without the porn"".","1.0 out of 5 stars","Next page→","https://www.amazon.com/Becoming-2015-Geovanni-Molina/product-reviews/B00M5KODWO/ref=cm_cr_arp_d_paging_btm_6?ie=UTF8&pageNumber=6&reviewerType=all_reviews"
"1574329460-11363","https://www.amazon.com/Becoming-2015-Geovanni-Molina/product-reviews/B00M5KODWO/ref=cm_cr_dp_d_show_all_btm?ie=UTF8&reviewerType=all_reviews","Amazon Customer","One Star","April 29, 2015","I would give it a zero if I could.","1.0 out of 5 stars","Next page→","https://www.amazon.com/Becoming-2015-Geovanni-Molina/product-reviews/B00M5KODWO/ref=cm_cr_arp_d_paging_btm_21?ie=UTF8&pageNumber=21&reviewerType=all_reviews"
"1574329498-11532","https://www.amazon.com/Becoming-2015-Geovanni-Molina/product-reviews/B00M5KODWO/ref=cm_cr_dp_d_show_all_btm?ie=UTF8&reviewerType=all_reviews","william","Two Stars","July 16, 2016","It was like a low budget  film.","2.0 out of 5 stars","Next page→","https://www.amazon.com/Becoming-2015-Geovanni-Molina/product-reviews/B00M5KODWO/ref=cm_cr_arp_d_paging_btm_38?ie=UTF8&pageNumber=38&reviewerType=all_reviews"
"1574329416-11175","https://www.amazon.com/Becoming-2015-Geovanni-Molina/product-reviews/B00M5KODWO/ref=cm_cr_dp_d_show_all_btm?ie=UTF8&reviewerType=all_reviews","Amazon Customer","HORRIBLE!!","September 13, 2015","If I could have given it a negative 5 star rating I would have. To be fair to it I suffered(and I mean SUFFERED) through 12 minutes of this steaming pile of bullcrap, but I just couldn't take it anymore. It was all too painful. The atrocious acting, the ridiculous plot. Just, well, UGH. The worst movie, and I use that term loosely, that I've watched in a very long time, and I've watched some REALLY bad ones!","1.0 out of 5 stars","Next page→","https://www.amazon.com/Becoming-2015-Geovanni-Molina/product-reviews/B00M5KODWO/ref=cm_cr_arp_d_paging_btm_2?ie=UTF8&pageNumber=2&reviewerType=all_reviews"
"1574329522-11651","https://www.amazon.com/Becoming-2015-Geovanni-Molina/product-reviews/B00M5KODWO/ref=cm_cr_dp_d_show_all_btm?ie=UTF8&reviewerType=all_reviews","Karen Del Giorno","One Star","August 11, 2015","this is THE WORST.","1.0 out of 5 stars","Next page→","https://www.amazon.com/Becoming-2015-Geovanni-Molina/product-reviews/B00M5KODWO/ref=cm_cr_arp_d_paging_btm_49?ie=UTF8&pageNumber=49&reviewerType=all_reviews"
"1574329434-11255","https://www.amazon.com/Becoming-2015-Geovanni-Molina/product-reviews/B00M5KODWO/ref=cm_cr_dp_d_show_all_btm?ie=UTF8&reviewerType=all_reviews","Cheri","One Star","October 7, 2015","This is such a b horror flicks. I couldn't get past the first 15 minutes","1.0 out of 5 stars","Next page→","https://www.amazon.com/Becoming-2015-Geovanni-Molina/product-reviews/B00M5KODWO/ref=cm_cr_arp_d_paging_btm_10?ie=UTF8&pageNumber=10&reviewerType=all_reviews"
"1574329541-11724","https://www.amazon.com/Becoming-2015-Geovanni-Molina/product-reviews/B00M5KODWO/ref=cm_cr_dp_d_show_all_btm?ie=UTF8&reviewerType=all_reviews","BKS","Is there anyway to give something Half or maybe a Quarter Star?","August 15, 2014","Is there anyway to give something Half or maybe a Quarter Star? How about an eighth?  I have to agree with someone else here, I made it to the graveyard scene and saw the first monster, my reaction, ""Oh you have got to be kidding me!"" at which point I shut it down.","1.0 out of 5 stars","Next page→","https://www.amazon.com/Becoming-2015-Geovanni-Molina/product-reviews/B00M5KODWO/ref=cm_cr_arp_d_paging_btm_57?ie=UTF8&pageNumber=57&reviewerType=all_reviews"
"1574329414-11162","https://www.amazon.com/Becoming-2015-Geovanni-Molina/product-reviews/B00M5KODWO/ref=cm_cr_dp_d_show_all_btm?ie=UTF8&reviewerType=all_reviews","Whovian","Don't waste your time","May 19, 2015","I love B movies but I definitely should have listened to the other reviews. I made it 22 mins into the movie before I had to give up. I mean, the acting was beyond bad. It was so bad that if I was one of those actors I would change my name, get plastic surgery done and never work as an actor again. Gabriel comes to earth, cuts off wings that are obviously strapped on, goes into a boxing training facility and fights a demon. But, and this was the last straw, all they do is push each other around between punching bags in fast motion and then Gabriel pulls out a knife and stabs the demon. The writing is atrocious, everyone talks like they're Arnold Schwarzenegger, and they don't even follow the basic standard that if you're truly a Christian, the demons can't touch you. Especially if you're wearing a cross. The sound effects of the movie are extremely annoying, the cut away scenes don't make sense. About the only positive thoughts for this movie come from the very beginning. I liked the effects they did with the actors names.

Only problem with writing a bad review is people are going to watch it to see for themselves if it can really be that bad. It is....bleh","1.0 out of 5 stars","",""
"1574329505-11568","https://www.amazon.com/Becoming-2015-Geovanni-Molina/product-reviews/B00M5KODWO/ref=cm_cr_dp_d_show_all_btm?ie=UTF8&reviewerType=all_reviews","JMRogers","One Star","December 13, 2015","This is worse than a B-rated movie!  Didn't last 2minutes!!","1.0 out of 5 stars","Next page→","https://www.amazon.com/Becoming-2015-Geovanni-Molina/product-reviews/B00M5KODWO/ref=cm_cr_arp_d_paging_btm_41?ie=UTF8&pageNumber=41&reviewerType=all_reviews"
"1574329460-11367","https://www.amazon.com/Becoming-2015-Geovanni-Molina/product-reviews/B00M5KODWO/ref=cm_cr_dp_d_show_all_btm?ie=UTF8&reviewerType=all_reviews","Santos M.","Two Stars","January 23, 2016","confusing!","2.0 out of 5 stars","Next page→","https://www.amazon.com/Becoming-2015-Geovanni-Molina/product-reviews/B00M5KODWO/ref=cm_cr_arp_d_paging_btm_21?ie=UTF8&pageNumber=21&reviewerType=all_reviews"
"1574329462-11377","https://www.amazon.com/Becoming-2015-Geovanni-Molina/product-reviews/B00M5KODWO/ref=cm_cr_dp_d_show_all_btm?ie=UTF8&reviewerType=all_reviews","mitch meade","Two Stars","February 1, 2016","Could be better.","2.0 out of 5 stars","Next page→","https://www.amazon.com/Becoming-2015-Geovanni-Molina/product-reviews/B00M5KODWO/ref=cm_cr_arp_d_paging_btm_22?ie=UTF8&pageNumber=22&reviewerType=all_reviews"
"1574329464-11388","https://www.amazon.com/Becoming-2015-Geovanni-Molina/product-reviews/B00M5KODWO/ref=cm_cr_dp_d_show_all_btm?ie=UTF8&reviewerType=all_reviews","Lightnin'","Terrible movie.","September 13, 2015","Only made it 8 minutes in. Terrible movie.","1.0 out of 5 stars","Next page→","https://www.amazon.com/Becoming-2015-Geovanni-Molina/product-reviews/B00M5KODWO/ref=cm_cr_arp_d_paging_btm_23?ie=UTF8&pageNumber=23&reviewerType=all_reviews"
"1574329528-11671","https://www.amazon.com/Becoming-2015-Geovanni-Molina/product-reviews/B00M5KODWO/ref=cm_cr_dp_d_show_all_btm?ie=UTF8&reviewerType=all_reviews","brian kissel","One Star","March 3, 2015","Boo!","1.0 out of 5 stars","Next page→","https://www.amazon.com/Becoming-2015-Geovanni-Molina/product-reviews/B00M5KODWO/ref=cm_cr_arp_d_paging_btm_51?ie=UTF8&pageNumber=51&reviewerType=all_reviews"
"1574329425-11217","https://www.amazon.com/Becoming-2015-Geovanni-Molina/product-reviews/B00M5KODWO/ref=cm_cr_dp_d_show_all_btm?ie=UTF8&reviewerType=all_reviews","CYNTHIA A. DALY","NOT GOOD","July 28, 2016","photography and sound were so bad that I ended up turning it off after 15 minutes.  Script sounded good but needed quality and better actors.","1.0 out of 5 stars","Next page→","https://www.amazon.com/Becoming-2015-Geovanni-Molina/product-reviews/B00M5KODWO/ref=cm_cr_arp_d_paging_btm_6?ie=UTF8&pageNumber=6&reviewerType=all_reviews"
"1574329507-11577","https://www.amazon.com/Becoming-2015-Geovanni-Molina/product-reviews/B00M5KODWO/ref=cm_cr_dp_d_show_all_btm?ie=UTF8&reviewerType=all_reviews","Luckson Lubin","One Star","November 12, 2015","I don't really  like the graphic, it seems like baby movie.","1.0 out of 5 stars","Next page→","https://www.amazon.com/Becoming-2015-Geovanni-Molina/product-reviews/B00M5KODWO/ref=cm_cr_arp_d_paging_btm_42?ie=UTF8&pageNumber=42&reviewerType=all_reviews"
"1574329467-11392","https://www.amazon.com/Becoming-2015-Geovanni-Molina/product-reviews/B00M5KODWO/ref=cm_cr_dp_d_show_all_btm?ie=UTF8&reviewerType=all_reviews","judy braga","Don't waste your time!","March 4, 2016","This movie was so bad...i cut it off after 10 minutes...","1.0 out of 5 stars","Next page→","https://www.amazon.com/Becoming-2015-Geovanni-Molina/product-reviews/B00M5KODWO/ref=cm_cr_arp_d_paging_btm_24?ie=UTF8&pageNumber=24&reviewerType=all_reviews"
"1574329430-11237","https://www.amazon.com/Becoming-2015-Geovanni-Molina/product-reviews/B00M5KODWO/ref=cm_cr_dp_d_show_all_btm?ie=UTF8&reviewerType=all_reviews","Heidi B.","No.","January 2, 2016","I had to stop watching after 10 minutes. It looked like a high school film project without the high schoolers.","1.0 out of 5 stars","Next page→","https://www.amazon.com/Becoming-2015-Geovanni-Molina/product-reviews/B00M5KODWO/ref=cm_cr_arp_d_paging_btm_8?ie=UTF8&pageNumber=8&reviewerType=all_reviews"
"1574329524-11654","https://www.amazon.com/Becoming-2015-Geovanni-Molina/product-reviews/B00M5KODWO/ref=cm_cr_dp_d_show_all_btm?ie=UTF8&reviewerType=all_reviews","seema cristallo","One Star","June 17, 2015","Very poor acting and quality","1.0 out of 5 stars","Next page→","https://www.amazon.com/Becoming-2015-Geovanni-Molina/product-reviews/B00M5KODWO/ref=cm_cr_arp_d_paging_btm_50?ie=UTF8&pageNumber=50&reviewerType=all_reviews"
"1574329545-11749","https://www.amazon.com/Becoming-2015-Geovanni-Molina/product-reviews/B00M5KODWO/ref=cm_cr_dp_d_show_all_btm?ie=UTF8&reviewerType=all_reviews","Michael Hight","not worth it","December 24, 2014","Sucks. Wish I spent my time clipping my dogs toenails","1.0 out of 5 stars","Next page→","https://www.amazon.com/Becoming-2015-Geovanni-Molina/product-reviews/B00M5KODWO/ref=cm_cr_arp_d_paging_btm_59?ie=UTF8&pageNumber=59&reviewerType=all_reviews"
"1574329449-11314","https://www.amazon.com/Becoming-2015-Geovanni-Molina/product-reviews/B00M5KODWO/ref=cm_cr_dp_d_show_all_btm?ie=UTF8&reviewerType=all_reviews","Aaliyah","Bad Movie Idea","August 22, 2015","The movie is low budget and all the things vampire movies are not.","1.0 out of 5 stars","Next page→","https://www.amazon.com/Becoming-2015-Geovanni-Molina/product-reviews/B00M5KODWO/ref=cm_cr_arp_d_paging_btm_16?ie=UTF8&pageNumber=16&reviewerType=all_reviews"
"1574329509-11582","https://www.amazon.com/Becoming-2015-Geovanni-Molina/product-reviews/B00M5KODWO/ref=cm_cr_dp_d_show_all_btm?ie=UTF8&reviewerType=all_reviews","Jesse","Low budget","September 7, 2015","Didnt even get to 10min before I decided to watch something else. I just couldnt get with low budget quality.","1.0 out of 5 stars","Next page→","https://www.amazon.com/Becoming-2015-Geovanni-Molina/product-reviews/B00M5KODWO/ref=cm_cr_arp_d_paging_btm_43?ie=UTF8&pageNumber=43&reviewerType=all_reviews"
"1574329451-11331","https://www.amazon.com/Becoming-2015-Geovanni-Molina/product-reviews/B00M5KODWO/ref=cm_cr_dp_d_show_all_btm?ie=UTF8&reviewerType=all_reviews","bigtrukz","One Star","June 28, 2015","just awful cant talk about cheap this wasnt even attempting to make a movie to watch","1.0 out of 5 stars","Next page→","https://www.amazon.com/Becoming-2015-Geovanni-Molina/product-reviews/B00M5KODWO/ref=cm_cr_arp_d_paging_btm_17?ie=UTF8&pageNumber=17&reviewerType=all_reviews"
"1574329498-11538","https://www.amazon.com/Becoming-2015-Geovanni-Molina/product-reviews/B00M5KODWO/ref=cm_cr_dp_d_show_all_btm?ie=UTF8&reviewerType=all_reviews","Amazon Customer","One Star","September 10, 2016","One star is very generous.","1.0 out of 5 stars","Next page→","https://www.amazon.com/Becoming-2015-Geovanni-Molina/product-reviews/B00M5KODWO/ref=cm_cr_arp_d_paging_btm_38?ie=UTF8&pageNumber=38&reviewerType=all_reviews"
"1574329416-11181","https://www.amazon.com/Becoming-2015-Geovanni-Molina/product-reviews/B00M5KODWO/ref=cm_cr_dp_d_show_all_btm?ie=UTF8&reviewerType=all_reviews","Movie freak","Looks like a low budget bad flick","August 19, 2015","Looks like a low budget bad flick.  I gave it 21 minutes hoping it would get better.  It didn't.
bad acting, bad photography, bad lines, bad directing.I should have looked at the ratings first, but I didn't.  Ugh.
Without the movie description, I would have had no idea what this poorly shot video was about.
Do not waste your time.  Even the costume department was cheesy.","1.0 out of 5 stars","Next page→","https://www.amazon.com/Becoming-2015-Geovanni-Molina/product-reviews/B00M5KODWO/ref=cm_cr_arp_d_paging_btm_2?ie=UTF8&pageNumber=2&reviewerType=all_reviews"
"1574329500-11543","https://www.amazon.com/Becoming-2015-Geovanni-Molina/product-reviews/B00M5KODWO/ref=cm_cr_dp_d_show_all_btm?ie=UTF8&reviewerType=all_reviews","Jacqueline","Don't waste your time!","May 2, 2016","Bad acting, stupid movie!","1.0 out of 5 stars","Next page→","https://www.amazon.com/Becoming-2015-Geovanni-Molina/product-reviews/B00M5KODWO/ref=cm_cr_arp_d_paging_btm_39?ie=UTF8&pageNumber=39&reviewerType=all_reviews"
"1574329543-11735","https://www.amazon.com/Becoming-2015-Geovanni-Molina/product-reviews/B00M5KODWO/ref=cm_cr_dp_d_show_all_btm?ie=UTF8&reviewerType=all_reviews","Anthony Jasso","Terrible, isn't even how I would explain it","December 15, 2014","Terrible, isn't even how I would explain it. The cover looked interesting, so I decided to watch it. The acting is horrific! Actors, who are these people, they were bad.. Sorry to say it, don't look at this movie, keep going.","1.0 out of 5 stars","Next page→","https://www.amazon.com/Becoming-2015-Geovanni-Molina/product-reviews/B00M5KODWO/ref=cm_cr_arp_d_paging_btm_58?ie=UTF8&pageNumber=58&reviewerType=all_reviews"
"1574329442-11291","https://www.amazon.com/Becoming-2015-Geovanni-Molina/product-reviews/B00M5KODWO/ref=cm_cr_dp_d_show_all_btm?ie=UTF8&reviewerType=all_reviews","Angela Barbour","One Star","March 12, 2016","I love most B movies, but this one really was bad.","1.0 out of 5 stars","Next page→","https://www.amazon.com/Becoming-2015-Geovanni-Molina/product-reviews/B00M5KODWO/ref=cm_cr_arp_d_paging_btm_13?ie=UTF8&pageNumber=13&reviewerType=all_reviews"
"1574329543-11737","https://www.amazon.com/Becoming-2015-Geovanni-Molina/product-reviews/B00M5KODWO/ref=cm_cr_dp_d_show_all_btm?ie=UTF8&reviewerType=all_reviews","Nannette Robinson","nor was the story very good.","August 25, 2014","Couldn't really get past the first 10 minutes. It wasn't very well shot, nor was the story very good.","1.0 out of 5 stars","Next page→","https://www.amazon.com/Becoming-2015-Geovanni-Molina/product-reviews/B00M5KODWO/ref=cm_cr_arp_d_paging_btm_58?ie=UTF8&pageNumber=58&reviewerType=all_reviews"
"1574329430-11241","https://www.amazon.com/Becoming-2015-Geovanni-Molina/product-reviews/B00M5KODWO/ref=cm_cr_dp_d_show_all_btm?ie=UTF8&reviewerType=all_reviews","Patricia P.","One Star","June 10, 2017","By far the dumbest movie I have ever wasted 5 minutes of my life on.","1.0 out of 5 stars","Next page→","https://www.amazon.com/Becoming-2015-Geovanni-Molina/product-reviews/B00M5KODWO/ref=cm_cr_arp_d_paging_btm_8?ie=UTF8&pageNumber=8&reviewerType=all_reviews"
"1574329493-11513","https://www.amazon.com/Becoming-2015-Geovanni-Molina/product-reviews/B00M5KODWO/ref=cm_cr_dp_d_show_all_btm?ie=UTF8&reviewerType=all_reviews","jason patterson","Low Rent waste O' time","July 22, 2015","I couldn't make it twenty minutes into this movie, everything about it was low rent.","1.0 out of 5 stars","Next page→","https://www.amazon.com/Becoming-2015-Geovanni-Molina/product-reviews/B00M5KODWO/ref=cm_cr_arp_d_paging_btm_36?ie=UTF8&pageNumber=36&reviewerType=all_reviews"
"1574329462-11380","https://www.amazon.com/Becoming-2015-Geovanni-Molina/product-reviews/B00M5KODWO/ref=cm_cr_dp_d_show_all_btm?ie=UTF8&reviewerType=all_reviews","Cheryl Jones","One Star","May 4, 2015","ridiculous. I watched about 15 minutes of it and turned it off","1.0 out of 5 stars","Next page→","https://www.amazon.com/Becoming-2015-Geovanni-Molina/product-reviews/B00M5KODWO/ref=cm_cr_arp_d_paging_btm_22?ie=UTF8&pageNumber=22&reviewerType=all_reviews"
"1574329518-11622","https://www.amazon.com/Becoming-2015-Geovanni-Molina/product-reviews/B00M5KODWO/ref=cm_cr_dp_d_show_all_btm?ie=UTF8&reviewerType=all_reviews","Mike","One Star","November 18, 2015","terrible","1.0 out of 5 stars","Next page→","https://www.amazon.com/Becoming-2015-Geovanni-Molina/product-reviews/B00M5KODWO/ref=cm_cr_arp_d_paging_btm_47?ie=UTF8&pageNumber=47&reviewerType=all_reviews"
"1574329423-11202","https://www.amazon.com/Becoming-2015-Geovanni-Molina/product-reviews/B00M5KODWO/ref=cm_cr_dp_d_show_all_btm?ie=UTF8&reviewerType=all_reviews","N. M.","""You've been a bad boy!""","March 23, 2015","Can movies have ingredients? This one has cheese in it. It is so cheesy, I found myself laughing.  It's really something Mystery Science Theater 3000 would have a field day with. Don't watch it expecting to be frightened..Muhahahaha!","2.0 out of 5 stars","Next page→","https://www.amazon.com/Becoming-2015-Geovanni-Molina/product-reviews/B00M5KODWO/ref=cm_cr_arp_d_paging_btm_5?ie=UTF8&pageNumber=5&reviewerType=all_reviews"
"1574329487-11491","https://www.amazon.com/Becoming-2015-Geovanni-Molina/product-reviews/B00M5KODWO/ref=cm_cr_dp_d_show_all_btm?ie=UTF8&reviewerType=all_reviews","Michael Bentley","Sic Semper Stultorum","August 27, 2014","They can keep the $1.99, but I want the 15 minutes of my life back. This one is a certain winner for the ""Tommy"" (The Tommy Wiseau Award for Excellence in Movie Stuff and Gud Speling). Maybe I'll watch the rest of it tomorrow, if nothing better comes along. Like re-arranging my sock drawer or staring vacantly at a shiny piece of glass. At least the local Walmart made a few bucks off the After Halloween Sale. I gave it one star because the opening credits were done well.
Sort of.","1.0 out of 5 stars","Next page→","https://www.amazon.com/Becoming-2015-Geovanni-Molina/product-reviews/B00M5KODWO/ref=cm_cr_arp_d_paging_btm_33?ie=UTF8&pageNumber=33&reviewerType=all_reviews"
"1574329449-11319","https://www.amazon.com/Becoming-2015-Geovanni-Molina/product-reviews/B00M5KODWO/ref=cm_cr_dp_d_show_all_btm?ie=UTF8&reviewerType=all_reviews","James S.","Two Stars","April 30, 2016","borring","2.0 out of 5 stars","Next page→","https://www.amazon.com/Becoming-2015-Geovanni-Molina/product-reviews/B00M5KODWO/ref=cm_cr_arp_d_paging_btm_16?ie=UTF8&pageNumber=16&reviewerType=all_reviews"
"1574329430-11236","https://www.amazon.com/Becoming-2015-Geovanni-Molina/product-reviews/B00M5KODWO/ref=cm_cr_dp_d_show_all_btm?ie=UTF8&reviewerType=all_reviews","EVEliason","The acting is horrible, the setting is cheap and the make-up fx ...","February 28, 2016","I normally don't watch ""B"" movies. I decided to take a chance on this one because the storyline seemed interesting. I had to stop 5 minutes into the film. The acting is horrible, the setting is cheap and the make-up fx is child-like.","1.0 out of 5 stars","Next page→","https://www.amazon.com/Becoming-2015-Geovanni-Molina/product-reviews/B00M5KODWO/ref=cm_cr_arp_d_paging_btm_8?ie=UTF8&pageNumber=8&reviewerType=all_reviews"
"1574329528-11668","https://www.amazon.com/Becoming-2015-Geovanni-Molina/product-reviews/B00M5KODWO/ref=cm_cr_dp_d_show_all_btm?ie=UTF8&reviewerType=all_reviews","Alton McClain","One Star","March 16, 2015","WORST MOVIE EVERRRRR","1.0 out of 5 stars","Next page→","https://www.amazon.com/Becoming-2015-Geovanni-Molina/product-reviews/B00M5KODWO/ref=cm_cr_arp_d_paging_btm_51?ie=UTF8&pageNumber=51&reviewerType=all_reviews"
